{
  "format": "zodiac-job@5",
  "job": {
    "id": "bocap-hai-phien-ban",
    "revision": "1.0"
  },
  "contract": {
    "id": "zodiac-authoring-ir",
    "version": "1.0.0",
    "sha256": "5728656019306975d7b3c4feabad9a02fa02cda2a22b38a27eff4563f3c77f95"
  },
  "renderer": {
    "id": "zodiac-renderer",
    "version": "2.0.0"
  },
  "producer": {
    "plugin": "zodiac-video-pipeline",
    "version": "2.0.0"
  }
}
